<?xml version="1.0" encoding="utf-8"?>
<xs:schema attributeFormDefault="unqualified" elementFormDefault="qualified" xmlns:xs="http://www.w3.org/2001/XMLSchema">
  <xs:element name="project">
    <xs:complexType>
      <xs:sequence>
        <xs:element name="scripts">
          <xs:complexType>
            <xs:sequence>
              <xs:element maxOccurs="unbounded" name="script">
                <xs:complexType>
                  <xs:attribute name="assembly" type="xs:string" use="optional" />
                  <xs:attribute name="name" type="xs:string" use="optional" />
                  <xs:attribute name="path" type="xs:string" use="optional" />
                </xs:complexType>
              </xs:element>
            </xs:sequence>
          </xs:complexType>
        </xs:element>
        <xs:element name="namespaces">
          <xs:complexType>
            <xs:sequence>
              <xs:element maxOccurs="unbounded" name="namespace" type="xs:string" />
            </xs:sequence>
          </xs:complexType>
        </xs:element>
        <xs:element name="singletons">
          <xs:complexType>
            <xs:sequence>
              <xs:element maxOccurs="unbounded" name="singleton">
                <xs:complexType mixed="true">
                  <xs:attribute name="name" type="xs:string" use="optional" />
                </xs:complexType>
              </xs:element>
            </xs:sequence>
          </xs:complexType>
        </xs:element>
      </xs:sequence>
    </xs:complexType>
  </xs:element>
</xs:schema>